{"reviewId":"9d8c7b6a-5f4e-4d3c-b2a1-0f9e8d7c6b5a","effect":"archive.delete","params":{"sourceIds":["3f9a1c2e-5b7d-4e8f-9a0b-1c2d3e4f5a6b"]},"paramsDigest":"aaaaaaaaaaaaaaaaaaaaaaaaaaaaaaaaaaaaaaaaaaaaaaaaaaaaaaaaaaaaaaaa","preconditions":{"sources":{"3f9a1c2e-5b7d-4e8f-9a0b-1c2d3e4f5a6b":2},"concerns":{"7c1d2e3f-4a5b-4c6d-8e7f-9a0b1c2d3e4f":1}},"preview":{"sources":[{"id":"3f9a1c2e-5b7d-4e8f-9a0b-1c2d3e4f5a6b","subject":null,"receivedAt":"2026-10-09T10:00:00.000Z","admission":"quarantine"}],"attachments":1,"concernsErased":["7c1d2e3f-4a5b-4c6d-8e7f-9a0b1c2d3e4f"],"concernsDetached":[],"derived":["search index"],"expectedCount":1},"expiresAt":"2026-10-09T10:10:00.000Z","requiresRecentAuth":true}
