{"reviewId":"9d8c7b6a-5f4e-4d3c-b2a1-0f9e8d7c6b5a","effect":"device.revoke","params":{"deviceId":"0b4e6f8a-2c3d-4e5f-8a9b-1c2d3e4f5a6b"},"paramsDigest":"aaaaaaaaaaaaaaaaaaaaaaaaaaaaaaaaaaaaaaaaaaaaaaaaaaaaaaaaaaaaaaaa","preconditions":{"devices":{"0b4e6f8a-2c3d-4e5f-8a9b-1c2d3e4f5a6b":3}},"preview":{"device":{"id":"0b4e6f8a-2c3d-4e5f-8a9b-1c2d3e4f5a6b","name":"Old tablet"},"current":false,"sessionsRevoked":1,"expectedCount":1},"expiresAt":"2026-10-09T10:10:00.000Z","requiresRecentAuth":true}
